timestamp,run_id,rank,market_number,market_title,side,consensus,consensus_count,total_models,reasoning,link
2026-01-05T15:06:54.981141,20260105_150654,1,1,"US strikes Iran by January 31, 2026?",NO/NO_TRADE (Conservative/Bearish),2 out of 2 models agreed,2,2,"Both models agree that a direct US strike on Iran is unlikely or not worth betting on, with one explicitly saying NO and the other recommending NO_TRADE due to the low probability and high uncertainty of this significant military escalation.",https://polymarket.com/event/us-strikes-iran-by
2026-01-05T15:34:00.046043,20260105_153400,1,3,Khamenei out as Supreme Leader of Iran by January 31?,NO,2 out of 2 models agreed,2,2,Both models strongly agree that a leadership transition within weeks is highly unlikely given Khamenei's entrenched power and absence of credible reports of imminent change.,https://polymarket.com/event/khamenei-out-as-supreme-leader-of-iran-by-january-31
2026-01-05T15:34:00.046043,20260105_153400,2,1,"Will Elon Musk post 580+ tweets from January 2 to January 9, 2026?",NO_TRADE,2 out of 2 models agreed,2,2,"Both models agree this is too unpredictable to bet on, citing either the extreme posting rate required or the impossibility of forecasting behavior over a year in advance.",https://polymarket.com/event/elon-musk-of-tweets-january-2-january-9
2026-01-05T15:34:00.046043,20260105_153400,3,2,Will António José Seguro win the 2026 Portugal presidential election?,NO_TRADE (with 1 YES outlier),"1 out of 2 models chose NO_TRADE, 1 chose YES",1,2,Limited consensus with split opinions - one model sees insufficient data while another identifies competitive polling and favorable conditions.,https://polymarket.com/event/portugal-presidential-election
2026-01-05T15:34:00.046043,20260105_153400,4,2,Will António José Seguro win the 2026 Portugal presidential election?,YES,1 out of 2 models agreed,1,2,Only one model took a position favoring YES based on polling data and political landscape analysis.,https://polymarket.com/event/portugal-presidential-election
2026-01-05T15:34:00.046043,20260105_153400,5,1,"Will Elon Musk post 580+ tweets from January 2 to January 9, 2026?",NO,0 out of 2 models agreed (both chose NO_TRADE instead),0,2,"No models took a definitive NO position, both preferring to abstain from trading on this unpredictable market.",https://polymarket.com/event/elon-musk-of-tweets-january-2-january-9
